Title,ID,Abstract,Full text,FT_Relevant_Lorena,FT_Relevant_Manuel,FT_Relevant_Katja,Comments_Lorena,Comments_Manuel,Comments_Katja,DOI
Discharge properties of neurones in the hand area of primary somatosensory cortex in monkeys in relation to the performance of an active tactile discrimination task - II. Area 2 as compared to areas 3b and 1,218,"The discharge patterns of 144 single cortical neurones, within the cutaneous representation of the hand in area 2 (primary somatosensory cortex, SI), were studied in two rhesus monkeys during the performance of an active tactile discrimination task. These were compared to those previously described for units within areas 3b and 1 recorded from the same animals. The task consisted of making a single scanning movement of the digit tips over a surface (first half smooth; second half either smooth or rough). The nature of the texture encountered over the second half of the surface was indicated by the monkey making a differential lever response (push or pull) with the opposite hand. During the task, area 2 units with cutaneous receptive fields (RFs) on the digit tips of interest (those scanned over the surfaces) generally showed an increase in their discharge (75%); patterns of decreased discharge or no modulation (respectively, 12 and 13%) were rarely observed. Units with digital cutaneous RFs not in contact with the stimuli were much more likely to show either a pattern of decreased discharge or no modulation whatsoever (47% in each case), suggesting that there is some selection of cutaneous inputs in this task in that non-active inputs are selectively gated. For units with a cutaneous RF, the sign of modulation changed significantly across SI, in a manner consistent with a pattern of increased convergence onto the more caudal regions of SI. Overall, the proportions of area 2 units with digital RFs on the tips of interest that were classified as either texturerelated (25%) or movement-related (26%) were similar to those reported previously for areas 3b and 1, suggesting that their presumed roles in, respectively, the analysis of surface texture and the representation of the physical parameters of movement are shared and distributed across the three cytoarchitectonic subdivisions of SI under consideration. In addition, the discharge patterns of single texture-related cells in areas 3b, 1 and 2 did not reliably signal whether or not the animal successfully discriminated the surfaces, suggesting that information from a population of cells is required for the performance of the task. Texture-related responses in area 2 were, however, unique in two ways. Firstly, 35% of the texture-related units had additional discharges related to the performance of the scanning movement (texture- and movement-related cells); no such units were found in area 3b, and only one was encountered in area 1. Secondly, the texture-related responses of a subgroup of area 2 units (25%) varied as a function of the order of presentation of the surfaces. As response time also varied with the order of presentation, it is suggested that such cells might represent an intermediate step in the transformation of the sensory input to a behavioural response. Although most units with digital RFs were more responsive during active tactile discrimination than during passive movements of the digits over the same surfaces, secondary factors (speed of movement) were often responsible for this observation. In this aspect, area 2 discharge properties seemed closer to those previously described for area 3b than to those described for area 1. In contrast to both areas 3b and 1, however, the extent of modulation in the task of one-third of the units with larger multi-digit RFs was similar to that produced by classical RF testing, instead of being less (as found for areas 3b and 1). The latter observation suggests that some tactile inputs from the digit tips of interest are transmitted to area 2 relatively unchanged during exploratory movements, and that gating controls in this task of active tactile discrimination may be directed more towards cutaneous inputs to areas 3b and 1 than to area 2. © 1992 Springer-Verlag.",,,,,Behavioral data?,,,10.1007/BF00231655
A comparison of the P300 and PET in patients with disorders of consciousness in absence of response to command,219,"Background and aims: Diagnosis of patients with disorders of consciousness (DOC) has become more accurate by using standardized behavioral assessment and objective measures of consciousness derived from neuroimaging. Another major challenge is the assessment of covert response to command in patients who do not present overt response to command, in order to ultimately find a means of communication. Methods: We assess the passive (auditory and tactile) and active (tactile) P300 ERP in twelve patients without behavioral command following to test its sensitivity for the detection of residual consciousness and confront it to cerebral metabolism as measured with glucose PET, the most sensitive objective diagnostic tool. Results: For the passive paradigms we have found that the accuracy of the discrimination of the standard and deviant stimuli in the auditory paradigm is higher for UWS than for MCS patients, while for the tactile paradigm the accuracy is slightly higher for MCS than UWS patients. There was no correlation between percentage of glucose metabolism reduction and P300 accuracy. One patient reached a high accuracy during the active tactile paradigm, suggestive of covert command following, even if behavioral command following was absent, and no discernable difference between the PET of this and other patients could be observed. Conclusion: Our results suggest that the passive P300 is not a good marker for consciousness or overall brain metabolism. On the other hand, the active P300 might probe covert command following in patients without behavioral response to command and therefore could be a valuable addition in the clinical assessment of DOC patients.",,,,,,,,
Influence of active encoding on tactile recognition memory for common objects,220,"Active tactile recognition memory for common objects is compared with passive touch. The recognition memory test occurs after a delay between inspection and test of seven days. Three groups of five each have the following conditions and results: Group I manipulated objects at bothinspection both inspection test to obtain a recognition rate of 87.9%; Group II manipulated objects at inspection but not at test, i.e., passive touch, to produce a recognition rate of 80,7%; Group III manipulated objects at test but not at inspection to perform at a 72.5% accuracy rate. Object manipulation had a significant effect and the group means were all significantly different (p≥.05), with the largest performance decrement due to passive touch at encoding. Generally, the findings implicated the importance of object identity in tactile recognition memory which, in turn, is supportive of the depth-of-processing approach to memory.",,,,,,,,10.2466/pms.1978.47.2.596
Discrimination Thresholds for Passive Tactile Volume Perception by Fingertips,49,"Haptic object perception is still poorly understood up to now. This study investigated the ability of human fingers to discriminate the volume of objects by passive touch. Experiments measured the discrimination threshold of volume using three tasks: passive tactile volume perception, passive tactile area perception, and active tactile volume perception. In each trial, we utilized two plastic cubes to successively stimulate the fingers, and participants were instructed to make comparisons between the stimulus objects’ volume and area. Results showed that there was no significant difference in the discrimination thresholds of tactile volume perception between passive touch and active touch, whereas significant differences in the discrimination thresholds between fingertips, such as the thumb versus the pinky finger. In passive touch, the discrimination thresholds of volume perception were larger than that with surface area perception. We found that the discrimination of the volume of objects is more difficult than the discrimination of the area of the objects.",,,,,,,,https://doi.org/10.1177/0301006619878560
Haptic information processing in direct and indirect memory tests,221,"Effects of learning can show up in a direct, i. e., an explicit, way or they can be expressed indirectly, i. e., in an implicit way. It was investigated whether motor processes underlie effects of repetition priming in haptic information exploration. In the test phase, blindfolded subjects had to handle objects in order to answer questions as fast as possible about their properties (e.g., temperature, texture, weight, or form), exploring the object with their hands. Some of the objects were old ones (presented in a study phase); others were added as new objects to the test phase. In addition, recognition judgements were required. The results demonstrated reliable effects of repetition priming in terms of reaction times to old, in comparison with new, objects for subjects who had been treated the same way in the study phase (active touch). Passive touch at encoding or studying the names or the visible objects themselves did not lead to effects of repetition priming in the test phase. On the other hand, performing adequate hand movements during the study improved recognition memory. The role of motor processes in indirect and direct tests of memory is discussed and related to research on memory of action events. © 1991 Springer-Verlag.",,,,,,,,10.1007/BF01371824
Tactual shape perception in relation to the understanding of geometrical concepts by blind students,222,"Tactual shape perception is a synthesis of many parameters which lead blind students to make sense of external stimuli. It is vital to investigate this field of perception because it reveals many differences between passive and active touch. The van Hiele model provides a tool for investigating and classifying students’ thinking in geometry. In a study of 19 blind and visually impaired students in a special school in Greece, we sought to understand their own way of approaching, developing and understanding concepts of shape. The findings support on one hand the appropriateness of the van Hiele theory and on the other the complexity of tactual shape perception and its uniqueness with respect to every student's thinking. Teachers and specialists can enrich their understanding and be more effective when teaching geometrical concepts that require taking into account variables such as: touch, movement, posture, type of shape, language, prior knowledge and the conditions of the task. © 2002, Sage Publications. All rights reserved.",,,,,Not sure if they have the comparisons we want.,,not an experiment,10.1177/026461960202000103
Object exploration using vision and active touch,223,"Achieving object exploration with passive vision and active touch has been under investigation for thirty years. We build upon recent progress in biomimetic active touch that combines perception via Bayesian evidence accumulation with controlling the tactile sensor using perceived stimulus location. Here, passive vision is combined with active touch by providing a visual prior for each perceptual decision, with the precision of this prior setting the relative contribution of each modality. The performance is examined on an edge following task using a tactile fingertip (the TacTip) mounted on a robot arm. We find that the quality of exploration is a U-shaped function of the relative contribution of vision and touch; moreover, multi-modal performance is more robust, completing the contour when touch alone fails. The overall system has several parallels with biological theories of perception, and thus plausibly represents a robot model of visuo-tactile exploration in humans.",,,,,,,,10.1109/IROS.2017.8206542
Effects of long-term sensory deprivation on asymmetric synapses in the whisker barrel field of the adult rat,224,"Whisker trimming deprives the cortical barrel field from the patterned sensory input that derives from active touch but leaves passive tactile signals unaltered. We have studied in the rat barrel field, by stereological procedures, the effects of a sustained period of unilateral deprivation by whisker clipping during adolescence and early adulthood on (1) the surface density (SV) of asymmetric synapses, as determined from measuring the presynaptic membrane specializations, and (2) the numerical density of asymmetric synaptic profiles (NA), classified according to their postsynaptic target and their apparent curvature. Compared to control rats, the procedure did not change the overall volume of the region, the volume fraction occupied by each cortical layer, or the volume fraction occupied by unmyelinated axons and boutons. However, the deprived barrel cortex displayed an increase in SV in layers I and II, and an increase in NA in layer I and in the cortex as a whole, mainly due to an increase in profiles with a convex shape. Layer IV was the least affected by the deprivation. These results point to a net increase, rather than a decrease, of excitatory synapses in the deprived cortex, which could result from a deprivation-induced decrease in the rate of normal synapse loss. This effect occurs specifically in superficial layers, more involved in intracortical and cortico-cortical, rather than thalamo-cortical, processing. © 2006 Elsevier B.V. All rights reserved.",,,,,,,,10.1016/j.brainres.2006.05.096
An fMRI study on cortical responses during active self-touch and passive touch from others,225,"Active, self-touch and the passive touch from an external source engage comparable afferent mechanoreceptors on the touched skin site. However, touch directed to glabrous skin compared to hairy skin will activate different types of afferent mechanoreceptors. Despite perceptual similarities between touch to different body sites, it is likely that the touch information is processed differently. In the present study, we used functional magnetic resonance imaging (fMRI) to elucidate the cortical differences in the neural signal of touch representations during active, self-touch and passive touch from another, to both glabrous (palm) and hairy (arm) skin, where a soft brush was used as the stimulus.There were two active touch conditions, where the participant used the brush in their right hand to stroke either their left palm or arm. There were two similar passive, touch conditions where the experimenter used an identical brush to stroke the same palm and arm areas on the participant. Touch on the left palm elicited a large, significant, positive blood-oxygenation level dependence (BOLD) signal in right sensorimotor areas. Less extensive activity was found for touch to the arm. Separate somatotopical palm and arm representations were found in Brodmann area 3 of the right primary somatosensory cortex (SI) and in both these areas, active stroking gave significantly higher signals than passive stroking. Active, self-touch elicited a positive BOLD signal in a network of sensorimotor cortical areas in the left hemisphere, compared to the resting baseline. In contrast, during passive touch, a significant negative BOLD signal was found in the left SI. Thus, each of the four conditions had a unique cortical signature despite similarities in afferent signalling or evoked perception. It is hypothesized that attentional mechanisms play a role in the modulation of the touch signal in the right SI, accounting for the differences found between active and passive touch.",,,,,I want to check if they show behavioral data,,,
Le toucher chez les enfants prématurés,226,"Touch being the first sense to develop in utero, it plays an essential role in the perceptual-cognitive development in infancy. The study of tactile skills in premature infants is a relevant approach to better understand the early development of touch. After briefly summarizing some elements of neurophysiological substrates of passive and active touch, namely the somatosensory system and its early development, this article describes, first, a review of experimental work on early skills of premature infants in both passive touch and active touch, and secondly, a summary of studies about two programs of developmental care in which touch is an essential component: the massage therapy and the kangaroo mother care. Overall, studies show in premature infants the occurrence of 1. discrimination subsequent to passive tactile stimulation from 30 weeks of gestation; 2. active manual discrimination between two different object shapes from 28 weeks and finally 3. beneficial effects on their neurodevelopmental future after receiving a massage therapy or the kangaroo mother care.",,,,,,,,10.4074/S0013754513001055
Occupation-related long-term sensory training enhances roughness discrimination but not tactile acuity,227,"Extensive use of sensorimotor properties has been shown to lead to use-dependent plasticity in the human motor cortex as well as sensory areas. The sensory consequences of these cortical changes, however, remain widely unclear. We were interested whether job-related long-term haptic training is measurable in terms of changes in haptic perception (active touch exploration) in manual physiotherapists (PT). To that end, the haptic thresholds of PT (students and employed) and registered osteopathic manual therapists (OMT; PT with postgraduate specialization) were measured and compared to age- and sex-matched control groups. Additionally, tactile acuity (passive static touch) was assessed using grating domes. PT and OMT had superior mean haptic thresholds compared to the control group, suggesting an increase in sensitivity through use. An age-related decline in haptic perception capacity occurred only in the control group, suggesting that the job-related training of the manual therapist groups may have slowed their age-related decline. Contrary to our expectation, we found significantly poorer mean haptic threshold results in the PT student group than for the controls. No significant differences or changes in tactile acuity were found for any of the groups (students and professional). The present results demonstrate use-dependent plasticity in manual therapists. Furthermore, the results underline the known effect of a superior discrimination ability of haptic as opposed to tactile perception. © 2014 Springer-Verlag.",,,,,,,,10.1007/s00221-014-3882-4
Active vs passive touch: The state of play & the future,228,"The active explorer has full control over their own movements, while a passive counterpart surrenders that control to some outside agency. The results of a number of experiments comparing active and passive exploration of two- and three-dimensional haptic stimuli are presented. In some circumstances active touch is superior, in others passive touch excels, while in still other instances no difference is found. A number of studies in progress are also described. ©2007 IEEE.",,,,,I do not know if this a review or an experimental series but for the title I would say a review. Check it,,review,10.1109/WHC.2007.18
Evaluation and Discrimination of Materials Motion By Active Tactual Motion,51,"In this paper, the role of the active tactual motion while judging the discrimination of material, that is acrylic, aluminum, cotton fabric, paper, rubber and wood, was investigated . The results are as follows. (1)The discrimination of material by the active tactual motion is better than that by the passive motion. (2)From the analysis result of the information theory, the amount of the transmitted information by the active touch is more than that by the passive touch in judging the discrimination of six materials.",,,,,,,,
Comparison of two olfactory cognitive responses measured by magnetoencephalography,52,The aim of this study is to measure and analyze perception and cognition in human olfaction using objective and non-invasive techniques. In the experiments event-related magnetic fields were measured by magnetoencephalography (MEG). We found two fundamental olfactory cognitive responses and their important difference considered as the results of the depending on olfactory cognitive mechanism between a passive olfaction and an active olfaction using sniffing method.,38.pdf (https://dl.airtable.com/.attachments/66f0dddbeb02ee78c488047544570e0c/13524158/38.pdf),,,,"behavioral data?
Sadly, NO behavioral data",,beautiful setup but no behavioral data,https://doi.org/10.1007/978-3-540-36841-0_692
Olfactory neuromagnetic responses measured by passive and active olfaction,230,,,,,,? behavioral data? No abstract?,,possible duplicate of 221,https://doi.org/10.1016/j.neures.2007.06.997
Neurons in the human basolateral amygdala and hippocampal formation do not respond to odors,231,"Extracellular action potentials were recorded from human hippocampal, hippocampal gyrus, and basolateral amygdala neurons during passive and active olfactory stimulation. Introduction of an odor into a continuous stream of air passing over the olfactory mucosa resulted in no detectable change in firing. Actively sniffing from an odorous flask, whether or not the odor was detected or recognized, also failed to elicit an immediate unit response. However, after a latency of 10-15 sec, the slight hyperventilation inherent in sniffing did induce a strong change in firing by many neurons. In contrast to these unit responses, a short-latency EEG spindle was recorded in the amygdala that appeared directly related to mechanical stimulation of the olfactory mucosa. © 1977.",,,,,,,,10.1016/0304-3940(77)90179-3
Age and Gender Related Normal Motion of the Cervical Spine,232,"The purpose of this study was to develop a clinical method for measuring throe-dimensional motion of the cervical spine usrnp the CA &DOD Spine Motion Analyzer (Orthopaedic Systems inc., Hayward CA.), Normal values for passive examinaons of flexion-extesnsion, lateral bending, rotation, rotation out of maximum fission, and notation put of maximum extension were obtained and analyzed for each gender in B group of 150 normal subjects. Gender classifications were further subdivided into age groups, with tsach dEcade containing asymptomatic volunteers. Values for each group were compared for differences wilh respect to ago and gandur differences. A detailed error analysis was also performed on the Interobserver and intraobserver repeatability, differences between pessive and active tasting, and the use of different fixation devices. Significantly decreased motion differences were found between age groups within gender, and between gender groups in corresponding dacados. Results of rotation out of maximum flexion suggest and support earlier cunclusiotis that the rotetion of the C1-C2 segment does not decrease with age, but rather increases slightly to perhaps compensate for the overall decreased motion in tine lower segments. © Lippincott-Raven Publishers.",,,,,,,,10.1097/00007632-199210001-00009
Evaluation of a conceptual framework for predicting navigation performance in virtual reality,233,"Previous research in spatial cognition has often relied on simple spatial tasks in static environments in order to draw inferences regarding navigation performance. These tasks are typically divided into categories (e.g., egocentric or allocentric) that reflect different two-systems theories. Unfortunately, this two-systems approach has been insufficient for reliably predicting navigation performance in virtual reality (VR). In the present experiment, participants were asked to learn and navigate towards goal locations in a virtual city and then perform eight simple spatial tasks in a separate environment. These eight tasks were organised along four orthogonal dimensions (static/dynamic, perceived/remembered, egocentric/allocentric, and distance/direction). We employed confirmatory and exploratory analyses in order to assess the relationship between navigation performance and performances on these simple tasks. We provide evidence that a dynamic task (i.e., intercepting a moving object) is capable of predicting navigation performance in a familiar virtual environment better than several categories of static tasks. These results have important implications for studies on navigation in VR that tend to over-emphasise the role of spatial memory. Given that our dynamic tasks required efficient interaction with the human interface device (HID), they were more closely aligned with the perceptuomotor processes associated with locomotion than wayfinding. In the future, researchers should consider training participants on HIDs using a dynamic task prior to conducting a navigation experiment. Performances on dynamic tasks should also be assessed in order to avoid confounding skill with an HID and spatial knowledge acquisition.",,,,,,,,10.1371/journal.pone.0184682
