Title,ID,Abstract,Full text,FT_Relevant_Lorena,FT_Relevant_Manuel,FT_Relevant_Katja,Comments_Lorena,Comments_Manuel,Comments_Katja,DOI
Sensitivity to dynamic auditory and visual stimuli predicts nonword reading ability in both dyslexic and normal readers,303,"Background: Developmental dyslexia is a specific disorder of reading and spelling that affects 3-9% of school-age children and adults. Contrary to the view that it results solely from deficits in processes specific to linguistic analysis, current research has shown that deficits in more basic auditory or visual skills may contribute to the reading difficulties of dyslexic individuals. These might also have a crucial role in the development of normal reading skills. Evidence for visual deficits in dyslexia is usually found only with dynamic and not static stimuli, implicating the magnocellular pathway or dorsal visual stream as the cellular locus responsible. Studies of such a dissociation between the processing of dynamic and static auditory stimuli have not been reported previously. Results: We show that dyslexic individuals are less sensitive both to particular rates of auditory frequency modulation (2 Hz and 40 Hz but not 240 Hz) and to dynamic visual-motion stimuli. There were high correlations, for both dyslexic and normal readers, between their sensitivity to the dynamic auditory and visual stimuli. Nonword reading, a measure of phonological awareness believed crucial to reading development, was also found to be related to these sensory measures. Conclusions: These results further implicate neuronal mechanisms that are specialised for detecting stimulus timing and change as being dysfunctional in many dyslexic individuals. The dissociation observed in the performance of dyslexic individuals on different auditory tasks suggests a sub-modality division similar to that already described in the visual system. These dynamic tests may provide a non-linguistic means of identifying children at risk of reading failure.",,,,,,,,10.1016/S0960-9822(98)70320-3
Thematic Cartography for the Society,304,"'Thematic Cartography for the Society' is prepared on the basis of the best 30 papers presented at the 5th International Conference on Cartography and GIS held in Albena, Bulgaria in 2014. The aim of the conference is to register new knowledge and shape experiences about the latest achievements in cartography and GIS worldwide. At the same time, the focus is on the important European region - the Balkan Peninsula. The following topics are covered:User-friendly Internet and Web Cartography; User-oriented Map Design and Production; Context-oriented Cartographic Visualization; Map Interfaces for Volunteered Geographic Information; Sensing Technologies and their Integration with Maps; Cartography in Education. focus on user-oriented cartographic approaches. User-Friendly Internet and Web Cartography -- Open Data Platform for Data Integration, Visualisation and Map Design -- A Web-Oriented Geoinformation System Application for Forest Fire Danger Prediction in Typical Forests of the Ukraine -- An Integrated Web Mapping Solution to Assess the Effect of SLR on the Northern Coast of EGYPT {u2013} EGSLR -- Heattile, a New Method for Heatmap Implementations for Mobile Web-based Cartographic Applications -- User-Oriented Map Design and Production -- Designing Simple and Complex Animated Maps for Users from Different Age Groups, Employing the Appropriate Selection of Static and Dynamic Visual and Sound Variables -- Optimising the Selection of a Number of Choropleth Map Classes -- Elaboration of the Technology for Development of Planning Freedom Maps Using GIS Tools -- The Solution of Massive Tasks in GIS Exemplified by Determining Terrain Surface Types above Gas Pipelines in the Czech Republic -- Approaches to Infrastructure Provision of Spatial Water-ecological Data on the Ob ̀River Basin Systems -- Cartography and Geovisualisation Techniques in the Exploratory Study of Geodiversity: Almeria Case Study -- The Geographical Size of a Country and Methods for Its Calculation and Mapping -- The Academic Atlas of Czech History -- Context-Oriented Cartographic Visualisation -- Cognitive Aspects of Geovisualisation: A Case Study of Active and Passive Exploration in a Virtual Environment -- Assessing the Completeness and Positional Accuracy of OpenStreetMap in China -- Combining Geographical and Social Dynamics in Dynamic 3D Environments -- Cartographic Symbols Depicting Ecoregion Properties -- Preparing Simplified 3D Scenes of Multiple LODs of Buildings in Urban Areas Based on a Raster Approach and Information Theory -- Quantification and Mapping of Flood Regulating Ecosystem Services in Different Watersheds {u2013} Case Studies in Bulgaria and Arizona, USA -- Sensing Technologies and their Integration with Maps -- Sensing Technologies and Their Integration with Maps: Mapping Landscape Heterogeneity by Satellite Imagery -- Analysis of Image Transformation and Land Use/Land Cover for Temperature Trends on Landsat Imagery -- Environmental Data Visualisation EnVIS {u2013} Linking Real-Time Sensor Data to Spatial Data Infrastructures for Web-Based Visualisation -- Cartographic Issues of Volunteer Mapping of Environmental Noise Using Mobile Phones -- Cartography in Education -- Maps of Mars Compiled by Students at Lomonosov Moscow State University -- The Use of Cartograms in School Cartography -- Cartography as Intentional Distortion.",,,,,,,,10.1007/978-3-319-08180-9
Head stabilization shows visual and inertial dependence during passive stimulation: Implications for virtual rehabilitation,305,"Sensorimotor coordination relies on the fine calibration and integration of visual, vestibular, and somatosensory input. Using virtual environments (VE) allows for the dissociation of visual and inertial inputs to manipulate human behavioral outputs. Our goal was to employ VE technology in a novel manner to investigate how head stabilization is affected by spatiotemporal properties of dynamic visual input when combined with passive motion on a linear sled. Healthy adults (n = 12) wore a head-mounted display during naso-occipital sinusoidal horizontal whole body translations while seated. Subjects were secured in a seat with a five-point harness, with the head free to move. Frequency and amplitude of sinusoidal input (i.e., inertial conditions) were set to create overlapping conditions of maximum acceleration (amax) or velocity (v max). Four inertial conditions were combined with four visual conditions (VIS). VIS were created so that direction of optic flow either matched direction of passive motion or did not. The effect of near and far fixation distance within the VE was also tested. Head kinematics were collected with a three-axis gyro. Head stability showed a complex interaction dependent on changes in weighting of visual and inertial inputs that changed with the sled driving frequency. Inertial condition affected amplitude (p < 0.0000) and phase (p < 0.0000) of head pitch angular velocity. In the absence of visual input, head pitch velocity amplitude increased (p < 0.01). An interaction effect between inertial and VIS conditions on head yaw occurred in SW (p < 0.05). There was also a significant interaction of depth of field and inertial condition on amplitude (p < 0.001) and phase ( p < 0.05 ) of head yaw velocity in SW, especially during high vmax conditions. We conclude visual flow can organize lateral cervical responses despite being discordant with inertial input. When using VE for rehabilitation, possible unintended, involuntary or reflexive motor responses that may not be present in traditional training environments should be taken into consideration. © 2001-2011 IEEE.",,,,,,,,10.1109/TNSRE.2012.2237040
Acoustic characteristics of English fricatives Spectral Properties of Fricative Consonants Acoustic characteristics of English fricatives,306,"This study constitutes a large-scale comparative analysis of acoustic cues for classification of place of articulation in fricatives. To date, no single metric has been found to classify fricative place of articulation with a high degree of accuracy. This study presents spectral, amplitudinal, and temporal measurements that involve both static properties spectral peak location, spectral moments, noise duration, normalized amplitude, and F2 onset frequency and dynamic properties relative amplitude and locus equations. While all cues except locus equations consistently serve to distinguish sibilant from nonsibilant fricatives, the present results indicate that spectral peak location, spectral moments, and both normalized and relative amplitude serve to distinguish all four places of fricative articulation. These findings suggest that these static and dynamic acoustic properties can provide robust and unique information about all four places of articulation, despite variation in speaker, vowel context, and voicing.",,,,,,,,10.1121/1.1288413
Perception of static and dynamic acoustic cues to place of articulation in initial stop consonants,307,"Two recent accounts of the acoustic cues which specify place of articulation in syllable-initial stop consonants claim that they are located in the initial portions of the C V waveform and are context-free. Stevens and Blumstein [J. Acoust. Soc. Am. 64, 1358–1368 (1978)] have described the perceptually relevant spectral properties of these cues as static, while Kewley-Port [J. Acoust. Soc. Am. 73, 322-335 (1983)] describes these cues as dynamic. Three perceptual experiments were conducted to test predictions derived from these accounts. Experiment 1 confirmed that acoustic cues for place of articulation are located in the initial 20–40 ms of natural stop-vowel syllables. Next, short synthetic CV's modeled after natural syllables were generated using either a digital, parallel-resonance synthesizer in experiment 2 or linear prediction synthesis in experiment 3. One set of synthetic stimuli preserved the static spectral properties proposed by Stevens and Blumstein. Another set of synthetic stimuli preserved the dynamic properties suggested by Kewley-Port. Listeners in both experiments identified place of articulation significantly better from stimuli which preserved dynamic acoustic properties than from those based on static onset spectra. Evidently, the dynamic structure of the initial stop-vowel articulatory gesture can be preserved in context-free acoustic cues which listeners use to identify place of articulation. © 1983, Acoustical Society of America. All rights reserved.",,,,,,,,10.1121/1.389402
NPV Sensitivity Analysis: A Dynamic Excel Approach,308,"Financial analysts generally create static formulas for the computation of NPV.  When they do so, however, it is not readily apparent how sensitive the value of NPV is to changes in multiple interdependent and interrelated variables. It is the aim of this paper to analyze this variability by employing a dynamic, visually graphic presentation using Excel.  Our approach illustrates how these variables, when increased or decreased to reflect the potential range of values in a business case, change the value of NPV, and hence affect the decision about whether to proceed with the project or to reject it. Furthermore, since sales revenue is one of the least certain elements in the business case, the presentation includes a probability estimate of whether NPV will be positive or negative, assuming that sales revenue is normally distributed with a known mean and standard deviation. The business case we have chosen for illustrative purposes is a global energy project. Nevertheless, financial analysts in any industry should be able to apply our dynamic spreadsheet approach to their projects as well.",,,,,,,,10.19030/ajbe.v10i3.9983
"Soundscape characterization in a dynamic acoustic environment: Grand Passage, Nova Scotia, a planned in-stream tidal energy site",309,"The marine environment in the Bay of Fundy hosts a dynamic and diverse soundscape that is a fundamental component of the local ecosystem. The emergence of new human marine activities and infrastructure, such as tidal turbine installations, introduces new sound sources that change or disrupt the existing acoustic environment, but the full extent of these changes is not well understood and is not predictable. To better evaluate the effects of future tidal energy development on the local soundscape in Grand Passage, Nova Scotia, a thorough understanding of the pre-development characteristics must be established. The present research seeks to identify existing anthropophony, biophony, and geophony, and to evaluate the underlying mechanisms contributing to geophonic variability. Passive acoustic measurements have been conducted using long-term moored omnidirectional hydrophones, a moored 5-channel array, and drifting hydrophone arrays, enabling identification of dominant signals and source direction, estimation of pseudonoise masking effects due to turbulent flow, and analysis of diurnal, daily, seasonal, and annual variability as well as spatial variability within the study area. This paper provides an overview of the dominant sound sources and discusses the effects of environmental forcing on soundscape characteristics.",,,,,,,,10.1121/2.0000246
Experimental analysis of acoustic field control-based robot navigation,310,"This paper proposes novel robot navigation methods that utilize strong interaction between a designed field and a robot controller. In recent years, several studies have demonstrated the importance of interactions between different subject types (e.g., human-robot interaction, robot-environment interaction) instead of just that between a robot controller and an isolated subject. This study explores the robot-field interaction design to realize autonomous robot navigation, and verifies the proposed methods experimentally. We prepare acoustic navigation trails from the start to the goal; one is generated from multiple sounds with identical frequencies, while the other is generated from multiple sounds with different frequencies. For each field controller, both the dynamic acoustic trail and the static acoustic trail, two types of static robot controllers are designed based only on the present sensor data, namely, gradient-following controller and sound-habituation controller. The former is a microphone-array based controller for robots equipped with multiple microphones, while the latter is designed for robots with a single microphone. Throughout the real-world demonstration, we show the validity of our proposed methods.",,,,,,,,10.20965/jrm.2019.p0110
Dynamic sound localization in cats,311,Sound localization in cats and humans relies on head-centered acoustic cues. Studies have shown that humans are able to localize sounds during rapid head movements that are directed toward the target or other objects of interest. We studied whether cats are able to utilize similar dynamic acoustic cues to localize acoustic targets delivered during rapid eye-head gaze shifts. We trained cats with visual-auditory two-step tasks in which we presented a brief sound burst during saccadic eye-head gaze shifts toward a prior visual target. No consistent or significant differences in accuracy or precision were found between this dynamic task (2-step saccade) and the comparable static task (single saccade when the head is stable) in either horizontal or vertical direction. Cats appear to be able to process dynamic auditory cues and execute complex motor adjustments to accurately localize auditory targets during rapid eyehead gaze shifts.,,,,,,,,10.1152/jn.00105.2015
Dynamic stimulation evokes spatially focused receptive fields in bat auditory cortex,312,"Bats can orient and hunt for prey in complete darkness using echolocation. Due to the pulse-like character of call emission they receive a stroboscopic view of their environment. During target approach, bats adjust their emitted echolocation calls to the specific requirements of the dynamically changing environmental and behavioral context. In addition to changes of the spectro-temporal call features, the spatial focusing of the beam of the sonar emissions onto the target is a conspicuous feature during target tracking. The neural processes underlying the complex sensory-motor interactions during target tracking are not well understood. In this study, we used a two-tone-pulse paradigm with 81 combinations of inter-aural intensity differences and six inter-pulse intervals in a passive hearing task to tackle the question of how transient changes in the azimuthal position of successive sounds are encoded by neurons in the auditory cortex of the bat Phyllostomus discolor. In a population of cortical neurons (11%, 24 of 217), spatial receptive fields were focused to a small region of frontal azimuthal positions during dynamic stimulation with tone-pulse pairs at short inter-pulse intervals. The response of these neurons might be important for the behaviorally observed locking of the sonar beam onto a selected target during the later stages of target tracking. Most interestingly, the majority of these neurons (88%, 21 of 24) were located in the posterior dorsal part of the auditory cortex. This cortical subfield might thus be specifically involved in the analysis of dynamic acoustic scenes. © The Authors (2010). Journal Compilation © 2010 Federation of European Neuroscience Societies and Blackwell Publishing Ltd.",,,,,,,,10.1111/j.1460-9568.2009.07051.x
Effects of directional hearing aid settings on different laboratory measures of spatial awareness perception,313,"Hearing loss can negatively influence the spatial hearing abilities of hearing-impaired listeners, not only in static but also in dynamic auditory environments. Therefore, ways of addressing these deficits with advanced hearing aid algorithms need to be investigated. In a previous study based on virtual acoustics and a computer simulation of different bilateral hearing aid fittings, we investigated auditory source movement detectability in older hearing- impaired (OHI) listeners. We found that two directional processing algorithms could substantially improve the detectability of left-right and near-far source movements in the presence of reverberation and multiple interfering sounds. In the current study, we carried out similar measurements with a loudspeaker-based setup and wearable hearing aids. We fitted a group of 15 OHI listeners with bilateral behind-the-ear devices that were programmed to have three different directional processing settings. Apart from source movement detectability, we assessed two other aspects of spatial awareness perception. Using a street scene with up to five environmental sound sources, the participants had to count the number of presented sources or to indicate the movement direction of a single target signal. The data analyses showed a clear influence of the number of concurrent sound sources and the starting position of the moving target signal on the participants’ performance, but no influence of the different hearing aid settings. Complementary artificial head recordings showed that the acoustic differences between the three hearing aid settings were rather small. Another explanation for the lack of effects of the tested hearing aid settings could be that the simulated street scenario was not sufficiently sensitive. Possible ways of improving the sensitivity of the laboratory measures while maintaining high ecological validity and complexity are discussed.",,,,,,,,10.4081/audiores.2018.215
Passive perceptual learning versus active searching in a novel stimuli vigilance task,314,"A criticism of laboratory vigilance or sustained attention research is the employment of static monotonous tasks with repetitive targets as opposed to the use of dynamic tasks with novel target stimuli. Unfortunately dynamic tasks employing novel stimuli may result in the mixture of two cognitive processes: active sustained attention search and passive perceptual learning. Moreover, the relative engagement of these two processes may depend on individual differences. In the present study, we examined this by having participants perform a dynamic auditory vigilance task with rare novel targets. In addition, some participants performed this task while also performing a secondary motor tracking task, a dual-task scenario. In the dual-task scenario, participants who failed to accurately detect the first target stimuli showed improvements in their tracking performance with time-on-task, suggesting reserves of attention. This improvement in tracking performance was not evident for those who accurately detected the first target stimuli, as their attention was likely actively engaged (searching). In addition, participants in the dual-task scenario who accurately detected the first target stimuli reported high workload and increased post-task tense arousal, results characteristic of participants performing static vigilance tasks. These results indicate the possibility that in a dynamic vigilance task with novel target stimuli participants may diverge in how they approach the task. Some participants will actively monitor the display for targets (search), whereas others will passively learn the target stimuli. Thus, these tasks may pose significant challenges to researchers who wish to examine vigilance in isolation from perceptual learning.",,,,,,,,10.1007/s00221-015-4222-z
Compression and its effect on the speech signal,315,"Compression systems are often used in hearing aids to increase the wearing comfort. A patient has to readjust frequently the gain of a linear hearing aid because of the limited dynamic hearing range and the changing acoustical conditions. A great deal of attention has been given to the static parameters but very little to the dynamic parameters. We present a general method to describe the dynamic behavior of a compression system by comparing modulations at the output with modulations at the input. The use of this method resulted in a single parameter describing the temporal characteristics of a compressor, the cut-off modulation frequency. In this paper its value is compared with known properties of running speech. A limitation of this method is the use of only small modulation depths, and the consequence of this limitation is tested. The use of this method is described for an experimental digital compressor developed by the authors, and the effects of some temporal parameters such as attack and release time are studied. This method shows the rather large effects of some of the parameters on the effectiveness of a compressor on speech. This method is also used to analyze two generally accepted compression systems in hearing aids. The theoretical method is next compared to the effects of compression on the distribution of the amplitude envelope of running speech, and it could be shown that single-channel compression systems do not reduce the distribution width of speech filtered in frequency bands. This finding questions the use of compression systems for fitting the speech banana in the dynamic hearing range of impaired listeners.",,,,,,,,10.1097/00003446-199604000-00008
Two- to Eight-Month-Old Infants' Perception of Dynamic Auditory-Visual Spatial Colocation,316,"From birth, infants detect associations between the locations of static visual objects and sounds they emit, but there is limited evidence regarding their sensitivity to the dynamic equivalent when a sound-emitting object moves. In 4 experiments involving thirty-six 2-month-olds, forty-eight 5-month-olds, and forty-eight 8-month-olds, we investigated infants' ability to process this form of spatial colocation. Whereas there was no evidence of spontaneous sensitivity, all age groups detected a dynamic colocation during habituation and looked longer at test trials in which sound and sight were dislocated. Only 2-month-olds showed clear sensitivity to the dislocation relation, although 8-month-olds did so following additional habituation. These results are discussed relative to the intersensory redundancy hypothesis and work suggesting increasing specificity in processing with age. © 2011 The Authors. Child Development © 2011 Society for Research in Child Development, Inc.",,,,,,,,10.1111/j.1467-8624.2011.01593.x
