Title,ID,Abstract,Full text,FT_Relevant_Lorena,FT_Relevant_Manuel,FT_Relevant_Katja,Comments_Lorena,Comments_Manuel,Comments_Katja,DOI
Dynamic alterations in chemokine gradients induce transendothelial shuttling of human T cells under physiologic shear conditions,115,"The active movement of cells from subendothelial compartments into the bloodstream (intravasation) has been recognized for several decades by histologic and physiologic studies, yet the molecular effectors of this process are relatively uncharacterized. For extravasation, studies based predominantly on static transwell assays support a general model, whereby transendothelial migration (TEM) occurs via chemoattraction toward increasing chemokine concentrations. However, this model of chemotaxis cannot readily reconcile how chemokines influence intravasation, as shear forces of blood flow would likely abrogate luminal chemokine gradient(s). Thus, to analyze how T cells integrate perivascular chemokine signals under physiologic flow, we developed a novel transwell-based flow chamber allowing for real-time modulation of chemokine levels above (luminal/apical compartment) and below (abluminal/subendothelial compartment) HUVEC monolayers. We routinely observed human T cell TEM across HUVEC monolayers with the combination of luminal CXCL12 and abluminal CCL5. With increasing concentrations of CXCL12 in the luminal compartment, transmigrated T cells did not undergo retrograde transendothelial migration (retro-TEM). However, when exposedto abluminal CXCL12, transmigrated T cells underwent striking retro-TEM and re-entered the flow stream [corrected]. This CXCL12 fugetactic (chemorepellant) effect was concentration-dependent, augmented by apical flow, blocked by antibodies to integrins, and reduced by AMD3100 in a dose-dependent manner. Moreover, CXCL12-induced retro-TEM was inhibited by PI3K antagonism and cAMP agonism. These findings broaden our understanding of chemokine biology and support a novel paradigm by which temporospatial modulations in subendothelial chemokine display drive cell migration from interstitial compartments into the bloodstream.",,,,,,,,10.1189/jlb.0309214
Role of peripheral afference during acquisition of a complex coordination task,34,"It has long been supposed that the interference observed in certain patterns of coordination is mediated, at least in part, by peripheral afference from the moving limbs. We manipulated the level of afferent input, arising from movement of the opposite limb, during the acquisition of a complex coordination task. Participants learned to generate flexion and extension movements of the right wrist, of 75° amplitude, that were a quarter cycle out of phase with a 1-Hz sinusoidal visual reference signal. On separate trials, the left wrist either was at rest, or was moved passively by a torque motor through 50°, 75° or 100°, in synchrony with the reference signal. Five acquisition sessions were conducted on successive days. A retention session was conducted 1 week later. Performance was initially superior when the opposite limb was moved passively than when it was static. The amplitude and frequency of active movement were lower in the static condition than in the driven conditions and the variation in the relative phase relation across trials was greater than in the driven conditions. In addition, the variability of amplitude, frequency and the relative phase relation during each trial was greater when the opposite limb was static than when driven. Similar effects were expressed in electromyograms. The most marked and consistent differences in the accuracy and consistency of performance (defined in terms of relative phase) were between the static condition and the condition in which the left wrist was moved through 50°. These outcomes were exhibited most prominently during initial exposure to the task. Increases in task performance during the acquisition period, as assessed by a number of kinematic variables, were generally well described by power functions. In addition, the recruitment of extensor carpi radialis (ECR), and the degree of co-contraction of flexor carpi radialis and ECR, decreased during acquisition. Our results indicate that, in an appropriate task context, afferent feedback from the opposite limb, even when out of phase with the focal movement, may have a positive influence upon the stability of coordination.",,,,,,might be of interest,comparison between static and passive,10.1007/s00221-002-1063-3
E36. FEATURES OF ALGORITHM-STAGE OF MEDICAL REHABILITATION OF PATIENTS AND DISABLEDS AFTER TOTAL ARTHROPLASTY IN ANKYLOSING SPONDYLARTHRITIS AND RHEUMATOID ARTHRITIS,116,"Background: Lesions of the hip especially hip ankylosis joints, manifested severe dysfunction of the lower extremities and spine on background of severe pain syndrome occupy one of the second largest ankylosing spondyloarthrosis. The purpose is to optimize the medical rehabilitation of pateints and disableds with pathology of ankylosing joints. Methods: In our clinic, during 2010-2015, total replacement of both coxofemoral joints were implemented in 14 patients. Age ranged from 25 to 49 years: 12 men and 2 women and 11 patients with ankylosing spondyloarthrosis and 3 with rheumatoid arthritis. Results: Massage courses of thigh and gluteal region and gymnastics classes with an active development movements in adjacent joints were performed in the process of preparing patients for surgery, which helps to strengthen thigh muscles biarticular and facilitates the process of postoperative recovery movements. Period of early functional rehabilitation begins in operation day in ward of intensive therapy. The patient were performed gymnastics in the hip on passive flexion of up to 10-15°C, an active movement in the ankle and knee joint. The patient is taught of self-fulfillment of isometric exercises for both lower extremities. The patient is taught to get up and go on the bed, take the stairs. The objective of the period of intensive functional rehabilitation is restore normal muscle strength and range of motion in the hip joint. During this period, electrical stimulation of abductor muscle groups are carried out and patients are involved in treadmill walking and balance development. Training and developing the correct gait of new movement patterns is carried out with the participation of the instructor and held in a specially equipped gymnastics hall. Positive (good) results were determined in 12 patients, two patients results were satisfactory result. Conclusion: Our algorithm-stage of rehabilitation of patients and disabled people after arthroplasty seems to be effective but requires further study.",,,,,,,,10.1093/rheumatology/kex063.035
Management of shoulder deformities in brachial plexus birth palsies,117,"Background: During the last century, there has been growing evidence that dislocation of the glenohumeral joint in children commonly occurs with brachial plexus birth palsy, often in the first year of life. Etiology: Permanent injuries to the brachial plexus in childhood create a muscle imbalance about the shoulder during the reinnervation process. This results in an internal rotation contracture, external rotation weakness, and subsequent glenoid retroversion, posterior deficiency, joint subluxation, and eventual dislocation. Evaluation: On physical examination with scapular stabilization, there is limited passive external rotation in adduction and abduction. Ultrasounds, arthrograms, and magnetic resonance imaging help in evaluating the deformity of glenohumeral deformity and dislocation. At present magnetic resonance imaging is the standard on which operative intervention is based. Treatment: Initial treatment is physical therapy with passive glenohumeral mobilization with scapular stabilization. Failure to regain or maintain passive external rotation and evidence of joint instability or dislocation on examination are indicators for for futher evaluation and intervention. Nonsurgical interventions such as Botox injections, or splinting or SPICA cast may be considered. Ultimately, contracture release, potential joint reduction, and extra-articular muscle transfer surgery has been the standard of care, though there is ongoing debate regarding whether release alone is sufficient. It is important not to overlengthen the subscapularis or over release the glenohumeral joint, which can cause loss of internal rotation power and development of external rotation contracture. Outcomes: Early operative intervention in the form of extra-articular rebalancing techniques has become the standard of care, providing the best opportunity for enhanced motion and function, and improved validated Mallet, Active Movement, and Pediatric Outcomes Data Collection Instrument scores. Long-term improvements in outcome may rest on joint remodeling by arthroscopic or open reduction, though further research is still required to evaluate remodeling of joints over the course of a lifetime. © 2010 by Lippincott Williams & Wilkins.",,,,,,,,10.1097/BPO.0b013e3181c1893d
Brain representation of active and passive hand movements in children,118,"Several functional neuroimaging studies have been performed exploring the sensorimotor function in children with neurologic disorders. However, little is known about normal activation patterns of the sensorimotor system at a young age. We explored brain representation of active and passive hand movements in school-age children and young adults. Nine healthy children (7-15 y) and six adults were studied. Functional magnetic resonance imaging (fMRI) data were acquired on a 1.5-T scanner in block designs. Active movement consisted of repetitive opening and closing of the hand; passive movement consisted of the same movement performed by the examiner. Both hands were assessed separately. The pattern of brain activation (contralateral primary sensorimotor cortex (SMC), ipsilateral cerebellum, supplementary motor area (SMA), and lateral premotor cortex (PMC) was generally more widespread in the adult group, suggesting a developmental course in the organization of both motor and sensory cortex. Surprisingly, no difference was generally detected when contrasting active versus passive tasks. Our results suggest that active and passive hand movements can be used for the exploration of the sensorimotor system in children. Passive and active tasks confirmed to be tightly coupled, thus supporting the idea of the former as a helpful performance-independent paradigm in the study of brain reorganization and presurgical assessment. © International Pediatrics Research Foundation, Inc. 2007. All Rights Reserved.",,,,,check behavioral data,only measure brain activity,,10.1203/pdr.0b013e3180332c2e
"Characteristics of shoulder-position sense: Effects of mode of movement, scapular support, and arm orientation",35,"Context: Although the repositioning test is widely used to evaluate proprioception, the effects of several test-associated variables on the test outcome are not known. Objective: To determine the effects of mode of movement, scapular support, and arm orientation on shoulder-position sense. Participants: 49 healthy, randomly selected men. Methods: The repositioning test was conducted in 4 settings in which mode of movement, scapular support, and arm orientation were manipulated differently. Main Outcome Measure: Position-sense acuity was quantified as repositioning accuracy and consistency. Results: Active limb movement significantly enhanced repositioning accuracy and consistency compared with passive movement. Repositioning consistency was significantly better when the scapula was supported than when it was not. Arm orientation had no significant effect on repositioning accuracy and consistency. Conclusion: The protocol for evaluating or rehabilitating shoulder proprioception should include active limb movement with the scapula unsupported to ensure that it reflects a patient's proprioceptive demand during functional activities.",,,,,,might be of interest,,https://doi.org/10.1123/jsr.11.3.157
Corticomotor excitability of wrist flexor and extensor muscles during active and passive movement,119,"The excitability of the corticospinal projection to upper and lower limbs is constantly modulated during voluntary and passive movement; however a direct comparison during a comparable movement has not been reported. In the present study we used transcranial magnetic stimulation (TMS) to compare corticomotor excitability to the extensor and flexor carpi radialis (ECR/FCR) muscles of the forearm during voluntary rhythmic wrist movement (through 45° of range), during a matched (for range and rhythm) passive movement of the wrist, and while the wrist was stationary (in mid-range). TMS was delivered when the wrist was in the neutral position. With passive and active movement, and for both FCR and ECR, corticomotor excitability was reduced during lengthening relative to shortening phases of movement. With active movement, this pattern was maintained and superimposed on an overall increase in excitability to both muscles that was greater for the ECR. The results favor a common pattern of excitability changes shared by extensor and flexor muscles as they undergo lengthening and shortening, which may be mediated by afferent input during both passive and active movement. This is combined with an overall increase in excitability associated with active movement that is greater for extensor muscles perhaps due to differences in the strength of the corticomotor projection to these muscles. © 2010 Elsevier B.V.",,,,,,,,10.1016/j.humov.2010.03.003
"4. Motor Rehabilitation, 4b. Rehab of Hemiplegic Upper Extremity Post Stroke",120,"The Seven Brunnstrom Stages of Motor Recovery (see table below for more details) 1. Flaccid paralysis. No reflexes. 2. Some spastic tone. No voluntary movement. Synergies elicited through facilitation. 3. Spasticity is marked. Synergistic movements may be elicited voluntarily. 4. Spasticity decreases. Synergistic movements predominate. 5. Spasticity wanes. Can move out of synergies although synergies still present. 6. Coordination and movement patterns near normal. Trouble with more rapid complex movements. 7. Normal. Stages of Motor Recovery of the Chedoke McMaster Stroke Impairment Inventory (Gowland et al. 1993) Stages Characteristics 1 Flaccid paralysis is present. Phasic stretch reflexes are absent or hypoactive. Active movement cannot be elicited reflexively with a facilitatory stimulus or volitionally. 2 Spasticity is present and is felt as a resistance to passive movement. No voluntary movement is present but a facilitatory stimulus will elicit the limb synergies reflexively. These limb synergies consist of stereotypical flexor and extensor movements. 3 Spasticity is marked. The synergistic movements can be elicited voluntarily but are not obligatory. 4 Spasticity decreases. Synergy patterns can be reversed if movement takes place in the weaker synergy first. Movement combining antagonistic synergies can be performed when the prime movers are the strong components of the synergy. 5 Spasticity wanes, but is evident with rapid movement and at the extremes of range. Synergy patterns can be revised even if the movement takes place in the strongest synergy first. Movements that utilize the weak components of both synergies acting as prime movers can be performed. 6 Coordination and patterns of movement can be near normal. Spasticity as demonstrated by resistance to passive movement is no longer present. Abnormal patterns of movement with faulty timing emerge when rapid or complex actions are requested. 7 Normal. A "" normal "" variety of rapid, age appropriate complex movement patterns are possible with normal timing, coordination, strength and endurance. There is no evidence of functional impairment compared with the normal side. There is a "" normal "" sensory-perceptual motor system. Stroke Rehabilitation Clinician Handbook 2016 Stroke Rehabilitation Clinician Handbook pg. 2 of 22 www.ebrsr.com 4.5.2 Typical Recovery and Predictors • Nakayama et al. (1994) reported that for stroke patients with severe arm paresis with little or no active movement at the time of hospital admission: o 14% complete motor recovery. o 30% partial recovery. • Kwakkel et al. (2003) reported that at 6 months, 11.6% of patients had achieved complete functional recovery, while 38% had some dexterity function. • Potential predictors of upper extremity recovery include active finger extension and shoulder abduction: o Active finger extension was found to be a strong predictor of short, medium and long term post-stroke recovery (Smania et al. 2007). o Minimal shoulder abduction and upper motor control of the paretic limb upon admission to rehabilitation had a reasonably good chance of regaining some hand capacity whereas patients without proximal arm control had a poor prognosis for regaining hand capacity (Houwink et al. 2013). o The EPOS study demonstrated that patients with some finger extension and shoulder abduction on Day 2 after stroke onset had a 98% probability of achieving some degree of dexterity at 6 months; this was in contrast to only 25% in those who did not show similar voluntary motor control. o In addition, 60% of patients with finger extension within 72 hours had regained full recovery of upper limb function according to ARAT score at 6 months. (Nijland et al. 2010).",,,,,,,,
Assessing proprioception: A critical review of methods,121,"To control movement, the brain has to integrate proprioceptive information from a variety of mechanoreceptors. The role of proprioception in daily activities, exercise, and sports has been extensively investigated, using different techniques, yet the proprioceptive mechanisms underlying human movement control are still unclear. In the current work we have reviewed understanding of proprioception and the three testing methods: threshold to detection of passive motion, joint position reproduction, and active movement extent discrimination, all of which have been used for assessing proprioception. The origin of the methods, the different testing apparatus, and the procedures and protocols used in each approach are compared and discussed. Recommendations are made for choosing an appropriate technique when assessing proprioceptive mechanisms in different contexts.",,,,,,review,,10.1016/j.jshs.2014.10.004
Diagnosis and classification of temporomandibular dysfunction by the general dental practitioner [Diagnostiek en classificatie van temporomandibulaire dysfuncties door de tandarts algemeen-practicus.],122,"Because of other diseases mimicking the symptoms of temporomandibular dysfunction (TMD), differential diagnosis is of the utmost importance. Diagnostic subgroups of TMD (osteoarthrosis, anterior disc displacement with/without reduction, TMD-myo) can be distinguished by a combination of active movements, passive opening and palpation. Active movement appeared to be the most powerful test for distinguishing the subgroups of TMD, e.g. myogenous, arthrogenous, myogenous and arthrogenous. It is advised to have an open mind in the clinical examination and to be aware of the many mimicking disorders before reaching a diagnosis. An anamnestic questionnaire addressing the pain history, signs and symptoms of TMD, functional impairments, correlates of TMD, psychosocial evaluation and general health status is mandatory. Headache and neck pain often accompany TMD. In appropriate situations it is advised to refer to the proper specialist, before starting treatment for TMD. Orthopedic tests of the cervical spine are of minor importance in discriminating between patients with TMD and patients with cervical spine disorders (CSD). It is therefore advised to evaluate the function of the stomatognathic system in patients with neck complaints to rule out a possible involvement of this system.",,,,,,,,
Rapid increases in ventilation accompany the transition from passive to active movement,123,"We used a novel movement transition technique to look for evidence of a rapid onset drive to breathe related to the active component of exercise in humans. Ten volunteers performed the following transitions in a specially designed tandem exercise chair apparatus: rest to passive movement, passive to active movement, and rest to active movement. The transition from rest to active exercise was accompanied by an immediate increase in ventilation, as was the transition from rest to passive leg movement (Δ = 6.06 ± 1.09 l min-1, p < 0.001 and Δ = 3.30 ± 0.57 l min-1, p = 0.002, respectively). When subjects actively assumed the leg movements, ventilation again increased immediately and significantly (Δ = 2.55 ± 0.52 l min-1, p = 0.032). Ventilation at the first point of active exercise was the same when started either from rest or from a background of passive leg movement (p = 1.00). We conclude that the use of a transition from passive to active leg movements in humans recruits a ventilatory drive related to the active component of exercise, and this can be discerned as a rapid increase in breathing. © 2005 Elsevier B.V. All rights reserved.",,,,,,ventilation and breathing,,10.1016/j.resp.2005.07.008
Effects of passive and active movement on vibrotactile detection thresholds of the Pacinian channel and forward masking,36,"We investigated the gating effect of passive and active movement on the vibrotactile detection thresholds of the Pacinian (P) psychophysical channel and forward masking. Previous work on gating mostly used electrocutaneous stimulation and did not allow focusing on tactile submodalities. Ten healthy adults participated in our study. Passive movement was achieved by swinging a platform, on which the participants stimulated hand was attached, manually by a trained operator. The root-mean-square value of the movement speed was kept in a narrow range (slow: 10-20 cm/s, fast: 50-60cm/s). Active movement was performed by the participant him-/herself using the same apparatus. The tactile stimuli consisted of 250-Hz sinusoidal mechanical vibrations, which were generated by a shaker mounted on the movement platform and applied to the middle fingertip. In the forward-masking experiments, a high-level masking stimulus preceded the test stimulus. Each movement condition was tested separately in a two-interval forced-choice detection task. Both passive and active movement caused a robust gating effect, that is, elevation of thresholds, in the fast speed range. Statistically significant change of thresholds was not found in slow movement conditions. Passive movement yielded higher thresholds than those measured during active movement, but this could not be confirmed statistically. On the other hand, the effect of forward masking was approximately constant as the movement condition varied. These results imply that gating depends on both peripheral and central factors in the P channel. Active movement may have some facilitatory role and produce less gating. Additionally, the results support the hypothesis regarding a critical speed for gating, which may be relevant for daily situations involving vibrations transmitted through grasped objects and for manual exploration.",,,,,,might be interesting,,https://doi.org/10.3109/08990220.2015.1091771
Transcortical reflexes and servo control of movement,124,"Sherrington proposed that the major role of proprioceptors is in processing afferent inputs generated by the active movements of the animal itself, and noted that the reflex effects of proprioceptive inputs are 'mild'. Current experimental results are consistent with the view that the major role of both segmental and transcortical proprioceptive reflexes is in small active movements and active postural stability, with muscle afferent inputs reducing '...errors of muscle length produced by fluctuating levels of motor discharge...' as stated by Goodwin and coworkers in 1978. Exteroceptive reflexes generate intense muscular responses and are of critical importance in prompt reprogramming essential for effective responses to environmental stimuli. Within the motor cortex (MI) there is a caudal region (MI/c) which receives exteroceptive cutaneous inputs and a rostral region (MI/r) which receives proprioceptive inputs. Transcortical reflexes mediated via pyramidal tract neurons (PTNs) of MI/r have properties which are analogous to segmental proprioceptive reflexes: changes of muscle length elicit PTN discharges which oppose the length change and so act to maintain stability. Furthermore, MI/r PTNs which are recruited earliest for small active movements are most sensitive to proprioceptive inputs. Data are not yet available concerning transcortical reflexes via MI/c during voluntary movement, but it is speculated that the cutaneous reflexes via MI/c might be functionally analogous to segmental cutaneous reflexes. Short-latency reflex responses also occur in postcentral (PoC) PTNs, and in this report we present results concerning the properties of PoC PTNs during active and passive movement. Caudal (area 2-5) PoC PTNs were similar to MI PTNs in that they often discharged prior to electromyogram (EMG) activity with active movement, and had different discharge frequencies with different steady state loads, but were unlike most MI PTNs in having the same changes of discharge with active and passive movement. Our finding of PoC discharge prior to movement onset, confirming that of Soso and Fetz in 1980, is discussed in connection with the concept of corollary discharge.",,,,,,,,10.1139/y81-112
